{"schema":"schema://mini-frank.source/v1","id":"src-blockwise-real-estate-pack","title":"Blockwise real-estate Ad Intelligence pack","kind":"local-file","locator":"apps/window/tools/ad-intelligence/packs/blockwise-real-estate.json","revision":"300d40a9e167f27d7083a9848d5a264fd97fff42","sha256":"e8ff1233d6e0c24a2fd6e0e0c0cb30ff4fbbc3203c084c95e0d2990680c938da","tier":"A","verified_at":"2026-08-22","retention_rights":"repository-owned"}
