{"schema":"schema://mini-frank.source/v1","id":"src-frank-memory-contract","title":"Frank memory contract","kind":"local-file","locator":"docs/MEMORY.md","revision":"363e0177459e94d509410c21c82f9c898f032c06","sha256":"c1c0c65008e1d7db707935a2bf9ca01ab0530ccf3493572c77b57c658d0c0c5d","tier":"A","verified_at":"2026-08-30","retention_rights":"repository-owned"}
