{"schema":"schema://mini-frank.source/v1","id":"src-outreach-contract","title":"Outreach contract","kind":"local-file","locator":"apps/window/tools/outreach/README.md","revision":"300d40a9e167f27d7083a9848d5a264fd97fff42","sha256":"58b2d3ded76f569c8a4b8850e468b84004d4f90dab698298148eaf3b61891904","tier":"A","verified_at":"2026-08-22","retention_rights":"repository-owned"}
