{"schema":"schema://mini-frank.source/v1","id":"src-frank-reuse-contract","title":"Frank reuse and data-boundary notes","kind":"local-file","locator":"apps/window/tools/REUSE.md","revision":"300d40a9e167f27d7083a9848d5a264fd97fff42","sha256":"4e39057c6569c9a3a1b5305d4f9a2253bfc7709195c232a053c1f6ad66927728","tier":"A","verified_at":"2026-08-22","retention_rights":"repository-owned"}
