{"schema":"schema://mini-frank.source/v1","id":"src-prospect-discovery-contract","title":"Prospect Discovery contract","kind":"local-file","locator":"apps/window/tools/prospect-discovery/README.md","revision":"300d40a9e167f27d7083a9848d5a264fd97fff42","sha256":"c539c6cff430ec090b975ad32ab30497e4f881ca03ebf2a6d108311b82de38e7","tier":"A","verified_at":"2026-08-22","retention_rights":"repository-owned"}
