{"schema":"schema://mini-frank.source/v1","id":"src-ad-intelligence-release-schema","title":"Ad Intelligence immutable release schema","kind":"local-file","locator":"apps/window/tools/ad-intelligence/schemas/release.schema.json","revision":"300d40a9e167f27d7083a9848d5a264fd97fff42","sha256":"45b3dbd47ff11d2a5962bcfce32cbb24b83db2743c9b3da68855c39e89e1d8f1","tier":"A","verified_at":"2026-08-22","retention_rights":"repository-owned"}
