{
  "schema": "schema://mini-frank.source/v1",
  "id": "src-frank-agent-rules",
  "title": "Frank agent rules",
  "kind": "local-file",
  "locator": "AGENTS.md",
  "revision": "sha256:752dd2f74032f952f8d97cb2c2792784beba7e806cfc3ed747c33cd8b061f851",
  "sha256": "752dd2f74032f952f8d97cb2c2792784beba7e806cfc3ed747c33cd8b061f851",
  "tier": "A",
  "verified_at": "2026-09-08",
  "retention_rights": "repository-owned"
}
