{"schema":"schema://mini-frank.source/v1","id":"src-content-factory-contract","title":"Content Factory contract","kind":"local-file","locator":"apps/window/tools/content-factory/README.md","revision":"300d40a9e167f27d7083a9848d5a264fd97fff42","sha256":"360f53575eee8ea21cdeabe41d431f4978c1ef92a0c9c66ff8dd71edcd1ad187","tier":"A","verified_at":"2026-08-22","retention_rights":"repository-owned"}
