{"schema":"schema://mini-frank.source/v1","id":"src-ad-intelligence-contract","title":"Ad Intelligence contract","kind":"local-file","locator":"apps/window/tools/ad-intelligence/README.md","revision":"git-blob:8d17be15460df6065b31e35c3faf0258324c44a2","sha256":"10144ab09fd08d402d00bbf862d1fb3e4b9f8e48df8ba36530abaf8a88493e7c","tier":"A","verified_at":"2026-09-15","retention_rights":"repository-owned"}
