{"schema":"schema://mini-frank.source/v1","id":"src-template-pack-contract","title":"Portable TemplatePack contract","kind":"local-file","locator":"apps/window/tools/ad-template-generator/TEMPLATEPACK.md","revision":"300d40a9e167f27d7083a9848d5a264fd97fff42","sha256":"96b785c222107d0146dbcd2e289881651ab3113256108e9cad2621c09fa1cd0e","tier":"A","verified_at":"2026-08-22","retention_rights":"repository-owned"}
