{"schema":"schema://mini-frank.source/v1","id":"src-frank-knowledge-generator-contract","title":"Frank project knowledge generator contract","kind":"local-file","locator":"apps/window/infra/knowledge/generate.sh","revision":"300d40a9e167f27d7083a9848d5a264fd97fff42","sha256":"b9299a15cd2adc01bdafd9625e35988765255bc585c99640460cadbe70a2df79","tier":"A","verified_at":"2026-08-22","retention_rights":"repository-owned"}
