{"schema":"schema://mini-frank.source/v1","id":"src-frank-graph-contract","title":"Frank graph assembly contract","kind":"local-file","locator":"apps/window/graph/ASSEMBLY.md","revision":"300d40a9e167f27d7083a9848d5a264fd97fff42","sha256":"396b5bb439e67ccd7fcc294bbc1724582510d08eba5ee27babd89e1dfb014aed","tier":"A","verified_at":"2026-08-22","retention_rights":"repository-owned"}
