{
  "schema": "schema://mini-frank.source/v1",
  "id": "src-frank-design-contract",
  "title": "Frank Window design contract",
  "kind": "local-file",
  "locator": "apps/window/DESIGN.md",
  "revision": "sha256:0bc67b150e30022009ce183b2f197a068bd7c1e66d273d568aaaf79046d3cf14",
  "sha256": "0bc67b150e30022009ce183b2f197a068bd7c1e66d273d568aaaf79046d3cf14",
  "tier": "A",
  "verified_at": "2026-09-05",
  "retention_rights": "repository-owned"
}
