{
  "schema": "schema://mini-frank.source/v1",
  "id": "src-frank-project-contract",
  "title": "Frank project contract",
  "kind": "local-file",
  "locator": "docs/PROJECT.md",
  "revision": "sha256:c353aaeb46943a45a7cba700edec494fda28a24bc4ede069e1509c8b6d6cb290",
  "sha256": "c353aaeb46943a45a7cba700edec494fda28a24bc4ede069e1509c8b6d6cb290",
  "tier": "A",
  "verified_at": "2026-09-06",
  "retention_rights": "repository-owned"
}
