{"schema":"schema://mini-frank.source/v1","id":"src-shadcn-ui-license","title":"shadcn/ui MIT licence at pinned revision","kind":"external-repository-license","locator":"https://raw.githubusercontent.com/shadcn-ui/ui/1773ecfeeb4a04366978d353e69b5c7ded78dcb2/LICENSE.md","revision":"1773ecfeeb4a04366978d353e69b5c7ded78dcb2","sha256":"1564074e13439397221ffd522e2e504d56561994a23d371aa5e3ad43e4f5423f","tier":"A","verified_at":"2026-08-22","retention_rights":"MIT licence permits retention and redistribution with notice"}
